{
  "name": "Ambul Jaiswal",
  "short_name": "Ambul",
  "tag": "Data science × cybersecurity · B.Tech CSE '28",
  "location": "Roorkee, India (IST)",
  "work_mode": "Open to remote, hybrid or on-site.",
  "email_parts": ["ambuljaiswal5", "gmail.com"],
  "calendar_url": "[[PLACEHOLDER: calendar link]]",
  "domain": "[[PLACEHOLDER: domain]]",
  "linkedin": "https://www.linkedin.com/in/ambul/",
  "github": [
    "https://github.com/ambulj",
    "https://github.com/Bloated11"
  ]
}
